name,logo,website,industry,summary,sector,size
MSFT,https://logo.clearbit.com/microsoft.com,http://www.microsoft.com,Software—Infrastructure,"Microsoft Corporation develops, licenses, and supports software, services, devices, and solutions worldwide. Its Productivity and Business Processes segment offers Office, Exchange, SharePoint, Microsoft Teams, Office 365 Security and Compliance, and Skype for Business, as well as related Client Access Licenses (CAL); Skype, Outlook.com, OneDrive, and LinkedIn; and Dynamics 365, a set of cloud-based and on-premises business solutions for small and medium businesses, large organizations, and divisions of enterprises. Its Intelligent Cloud segment licenses SQL and Windows Servers, Visual Studio, System Center, and related CALs; GitHub that provides a collaboration platform and code hosting service for developers; and Azure, a cloud platform. It also offers support services and Microsoft consulting services to assist customers in developing, deploying, and managing Microsoft server and desktop solutions; and training and certification to developers and IT professionals on various Microsoft products. Its More Personal Computing segment provides Windows original equipment manufacturer (OEM) licensing and other non-volume licensing of the Windows operating system; Windows Commercial, such as volume licensing of the Windows operating system, Windows cloud services, and other Windows commercial offerings; patent licensing; Windows Internet of Things; and MSN advertising. It also offers Surface, PC accessories, PCs, tablets, gaming and entertainment consoles, and other devices; Gaming, including Xbox hardware, and Xbox content and services; video games and third-party video game royalties; and Search, including Bing and Microsoft advertising. It sells its products through OEMs, distributors, and resellers; and directly through digital marketplaces, online stores, and retail stores. It has a strategic collaboration with DXC Technology and Dynatrace, Inc. The company was founded in 1975 and is headquartered in Redmond, Washington.",Technology,163000
AAPL,https://logo.clearbit.com/apple.com,http://www.apple.com,Consumer Electronics,"Apple Inc. designs, manufactures, and markets smartphones, personal computers, tablets, wearables, and accessories worldwide. It also sells various related services. The company offers iPhone, a line of smartphones; Mac, a line of personal computers; iPad, a line of multi-purpose tablets; and wearables, home, and accessories comprising AirPods, Apple TV, Apple Watch, Beats products, HomePod, iPod touch, and other Apple-branded and third-party accessories. It also provides AppleCare support services; cloud services store services; and operates various platforms, including the App Store, that allow customers to discover and download applications and digital content, such as books, music, video, games, and podcasts. In addition, the company offers various services, such as Apple Arcade, a game subscription service; Apple Music, which offers users a curated listening experience with on-demand radio stations; Apple News+, a subscription news and magazine service; Apple TV+, which offers exclusive original content; Apple Card, a co-branded credit card; and Apple Pay, a cashless payment service, as well as licenses its intellectual property. The company serves consumers, and small and mid-sized businesses; and the education, enterprise, and government markets. It sells and delivers third-party applications for its products through the App Store. The company also sells its products through its retail and online stores, and direct sales force; and third-party cellular network carriers, wholesalers, retailers, and resellers. Apple Inc. was founded in 1977 and is headquartered in Cupertino, California.",Technology,100000
GOOG,https://logo.clearbit.com/abc.xyz,http://www.abc.xyz,Internet Content & Information,"Alphabet Inc. provides online advertising services in the United States, Europe, the Middle East, Africa, the Asia-Pacific, Canada, and Latin America. The company offers performance and brand advertising services. It operates through Google Services, Google Cloud, and Other Bets segments. The Google Services segment provides products and services, such as ads, Android, Chrome, hardware, Google Maps, Google Play, Search, and YouTube, as well as technical infrastructure; and digital content. The Google Cloud segment offers infrastructure and data analytics platforms, collaboration tools, and other services for enterprise customers. The Other Bets segment sells internet and TV services, as well as licensing and research and development services. The company was founded in 1998 and is headquartered in Mountain View, California.",Communication Services,139995
NVDA,https://logo.clearbit.com/nvidia.com,http://www.nvidia.com,Semiconductors,"NVIDIA Corporation operates as a visual computing company worldwide. It operates in two segments, Graphics and Compute & Networking. The Graphics segment offers GeForce GPUs for gaming and PCs, the GeForce NOW game streaming service and related infrastructure, and solutions for gaming platforms; Quadro/NVIDIA RTX GPUs for enterprise design; GRID software for cloud-based visual and virtual computing; and automotive platforms for infotainment systems. The Compute & Networking segment offers Data Center platforms and systems for AI, HPC, and accelerated computing; Mellanox networking and interconnect solutions; automotive AI Cockpit, autonomous driving development agreements, and autonomous vehicle solutions; and Jetson for robotics and other embedded platforms. The company's products are used in gaming, professional visualization, datacenter, and automotive markets. NVIDIA Corporation sells its products to original equipment manufacturers, original device manufacturers, system builders, add-in board manufacturers, retailers/distributors, Internet and cloud service providers, automotive manufacturers and tier-1 automotive suppliers, mapping companies, start-ups, and other ecosystem participants. NVIDIA Corporation was founded in 1993 and is headquartered in Santa Clara, California.",Technology,18975
TSLA,https://logo.clearbit.com/tesla.com,http://www.tesla.com,Auto Manufacturers,"Tesla, Inc. designs, develops, manufactures, leases, and sells electric vehicles, and energy generation and storage systems in the United States, China, and internationally. The company operates in two segments, Automotive, and Energy Generation and Storage. The Automotive segment offers electric vehicles, as well as sells automotive regulatory credits. It provides sedans and sport utility vehicles through direct and used vehicle sales, a network of Tesla Superchargers, and in-app upgrades; and purchase financing and leasing services. This segment is also involved in the provision of non-warranty after-sales vehicle services, sale of used vehicles, retail merchandise, and vehicle insurance, as well as sale of products through its subsidiaries to third party customers; services for electric vehicles through its company-owned service locations, and Tesla mobile service technicians; and vehicle limited warranties and extended service plans. The Energy Generation and Storage segment engages in the design, manufacture, installation, sale, and leasing of solar energy generation and energy storage products, and related services to residential, commercial, and industrial customers and utilities through its website, stores, and galleries, as well as through a network of channel partners. This segment also offers service and repairs to its energy product customers, including under warranty; and various financing options to its solar customers. The company was formerly known as Tesla Motors, Inc. and changed its name to Tesla, Inc. in February 2017. Tesla, Inc. was founded in 2003 and is headquartered in Palo Alto, California.",Consumer Cyclical,70757
NFLX,https://logo.clearbit.com/netflix.com,http://www.netflix.com,Entertainment,"Netflix, Inc. provides entertainment services. It offers TV series, documentaries, and feature films across various genres and languages. The company provides members the ability to receive streaming content through a host of Internet-connected devices, including TVs, digital video players, television set-top boxes, and mobile devices. It also provides DVDs-by-mail membership services. The company has approximately 204 million paid members in 190 countries. Netflix, Inc. was founded in 1997 and is headquartered in Los Gatos, California.",Communication Services,9400
AMZN,https://logo.clearbit.com/amazon.com,http://www.amazon.com,Internet Retail,"Amazon.com, Inc. engages in the retail sale of consumer products and subscriptions in North America and internationally. The company operates through three segments: North America, International, and Amazon Web Services (AWS). It sells merchandise and content purchased for resale from third-party sellers through physical and online stores. The company also manufactures and sells electronic devices, including Kindle, Fire tablets, Fire TVs, Rings, and Echo and other devices; provides Kindle Direct Publishing, an online service that allows independent authors and publishers to make their books available in the Kindle Store; and develops and produces media content. In addition, it offers programs that enable sellers to sell their products on its websites, as well as its stores; and programs that allow authors, musicians, filmmakers, skill and app developers, and others to publish and sell content. Further, the company provides compute, storage, database, analytics, machine learning, and other services, as well as fulfillment, advertising, publishing, and digital content subscriptions. Additionally, it offers Amazon Prime, a membership program, which provides free shipping of various items; access to streaming of movies and TV episodes; and other services. The company serves consumers, sellers, developers, enterprises, and content creators. Amazon.com, Inc. was founded in 1994 and is headquartered in Seattle, Washington.",Consumer Cyclical,1271000
FB,https://logo.clearbit.com/investor.fb.com,http://investor.fb.com,Internet Content & Information,"Facebook, Inc. develops products that enable people to connect and share with friends and family through mobile devices, personal computers, virtual reality headsets, and in-home devices worldwide. The company's products include Facebook that enables people to connect, share, discover, and communicate with each other on mobile devices and personal computers; Instagram, a community for sharing photos, videos, and private messages; Messenger, a messaging application for people to connect with friends, family, groups, and businesses across platforms and devices; and WhatsApp, a messaging application that is used by people and businesses to communicate in a private way. It also provides Facebook Reality Labs, an augmented and virtual reality product that help people feel connected, anytime, and anywhere. Facebook, Inc. was founded in 2004 and is headquartered in Menlo Park, California.",Communication Services,60654
GM,https://logo.clearbit.com/gm.com,http://www.gm.com,Auto Manufacturers,"General Motors Company designs, builds, and sells cars, trucks, crossovers, and automobile parts worldwide. The company operates through GM North America, GM International, Cruise, and GM Financial segments. It markets its vehicles primarily under the Buick, Cadillac, Chevrolet, GMC, Holden, Baojun, and Wuling brand names. The company also sells trucks, crossovers, and cars to dealers for consumer retail sales, as well as to fleet customers, including daily rental car companies, commercial fleet customers, leasing companies, and governments. In addition, it offers safety and security services for retail and fleet customers, including automatic crash response, emergency services, roadside assistance, crisis assist, stolen vehicle assistance, and turn-by-turn navigation, as well as connected services comprising mobile applications for owners to remotely control their vehicles and electric vehicle owners to locate charging stations, on-demand vehicle diagnostics, smart driver, marketplace in-vehicle commerce, connected navigation, SiriusXM with 360L, and 4G LTE wireless connectivity. Further, the company provides automotive financing services; and operates an online store. General Motors Company was founded in 1908 and is headquartered in Detroit, Michigan.",Consumer Cyclical,155000
ABBV,https://logo.clearbit.com/abbvie.com,http://www.abbvie.com,Drug Manufacturers—General,"AbbVie Inc. discovers, develops, manufactures, and sells pharmaceuticals in the worldwide. The company offers HUMIRA, a therapy administered as an injection for autoimmune and intestinal BehÃ§et's diseases; SKYRIZI to treat moderate to severe plaque psoriasis in adults; RINVOQ, a JAK inhibitor for the treatment of moderate to severe active rheumatoid arthritis in adult patients; IMBRUVICA to treat adult patients with chronic lymphocytic leukemia (CLL), small lymphocytic lymphoma (SLL), mantle cell lymphoma, waldenstrÃ¶m's macroglobulinemia, marginal zone lymphoma, and chronic graft versus host disease; VENCLEXTA, a BCL-2 inhibitor used to treat adults with CLL or SLL; and MAVYRET to treat patients with chronic HCV genotype 1-6 infection. It also provides CREON, a pancreatic enzyme therapy for exocrine pancreatic insufficiency; Synthroid used in the treatment of hypothyroidism; AndroGel for males diagnosed with symptomatic low testosterone; Linzess/Constella to treat irritable bowel syndrome with constipation and chronic idiopathic constipation; Lupron for the palliative treatment of advanced prostate cancer, endometriosis and central precocious puberty, and patients with anemia caused by uterine fibroids; and Botox therapeutic. In addition, the company offers ORILISSA, a nonpeptide small molecule gonadotropin-releasing hormone antagonist for women with moderate to severe endometriosis pain; Duopa and Duodopa, a levodopa-carbidopa intestinal gel to treat Parkinson's disease; Lumigan/Ganfort, a bimatoprost ophthalmic solution for the reduction of elevated intraocular pressure (IOP) in patients with open angle glaucoma (OAG) or ocular hypertension; Ubrelvy to treat migraine with or without aura in adults; Alphagan/ Combigan, an alpha-adrenergic receptor agonist for the reduction of IOP in patients with OAG; and Restasis, a calcineurin inhibitor immunosuppressant to increase tear production. The company was incorporated in 2012 and is based in North Chicago, Illinois.",Healthcare,47000
JPM,https://logo.clearbit.com/jpmorganchase.com,http://www.jpmorganchase.com,Banks—Diversified,"JPMorgan Chase & Co. operates as a financial services company worldwide. It operates in four segments: Consumer & Community Banking (CCB), Corporate & Investment Bank (CIB), Commercial Banking (CB), and Asset & Wealth Management (AWM). The CCB segment offers deposit and investment products and services to consumers; lending, deposit, and cash management and payment solutions to small businesses; mortgage origination and servicing activities; residential mortgages and home equity loans; and credit card, auto loan, and leasing services. The CIB segment provides investment banking products and services, including corporate strategy and structure advisory, and equity and debt markets capital-raising services, as well as loan origination and syndication; wholesale payments and cross-border financing; and cash securities and derivative instruments, risk management solutions, prime brokerage, and research. This segment also offers securities services, including custody, fund accounting and administration, and securities lending products for asset managers, insurance companies, and public and private investment funds. The CB segment provides financial solutions, including lending, investment banking, and asset management to small business, large and midsized corporations, local governments, and nonprofit clients; and commercial real estate banking services to investors, developers, and owners of multifamily, as well as to office, retail, industrial, and affordable housing properties. The AWM segment offers multi-asset investment management solutions across equities, fixed income, alternatives, and money market funds to institutional clients and retail investors; and retirement products and services, brokerage, custody, trusts and estates, loans, mortgages, deposits, and investment management products. The company also provides ATM, online and mobile, and telephone banking services. JPMorgan Chase & Co. was founded in 1799 and is headquartered in New York, New York.",Financial Services,259350
JNJ,https://logo.clearbit.com/jnj.com,http://www.jnj.com,Drug Manufacturers—General,"Johnson & Johnson researches and develops, manufactures, and sells a range of products in the health care field worldwide. It operates through three segments: Consumer Health, Pharmaceutical, and Medical Devices. The Consumer Health segment offers baby care products under the JOHNSON'S and AVEENO Baby brands; oral care products under the LISTERINE brand; skin health/beauty products under the AVEENO, CLEAN & CLEAR, DR. CI:LABO, NEUTROGENA, and OGX brands; acetaminophen products under the TYLENOL brand; cold, flu, and allergy products under the SUDAFED brand; allergy products under the BENADRYL and ZYRTEC brands; ibuprofen products under the MOTRIN IB brand; smoking cessation products under the NICORETTE brand; and acid reflux products under the PEPCID brand. This segment also provides women's health products, such as sanitary pads and tampons under the STAYFREE, CAREFREE, and o.b. brands; wound care products comprising adhesive bandages under the BAND-AID brand; and first aid products under the NEOSPORIN brand. The Pharmaceutical segment offers products in various therapeutic areas, including immunology, infectious diseases, neuroscience, oncology, pulmonary hypertension, and cardiovascular and metabolic diseases. The Medical Devices segment provides electrophysiology products to treat cardiovascular diseases and neurovascular care products to treat hemorrhagic and ischemic stroke; orthopaedics products in support of hips, knees, trauma, spine, sports, and other; advanced and general surgery solutions that focus on breast aesthetics, ear, nose, and throat procedures; and disposable contact lenses and ophthalmic products related to cataract and laser refractive surgery under the ACUVUE brand. The company markets its products to general public, and retail outlets and distributors, as well as distributes directly to wholesalers, hospitals, and health care professionals for prescription use. Johnson & Johnson was founded in 1886 and is based in New Brunswick, New Jersey.",Healthcare,134500
DIS,https://logo.clearbit.com/thewaltdisneycompany.com,http://www.thewaltdisneycompany.com,Entertainment,"The Walt Disney Company, together with its subsidiaries, operates as an entertainment company worldwide. The company's Media Networks segment operates domestic cable networks under the Disney, ESPN, Freeform, FX, and National Geographic brands; and television broadcast network under the ABC brand, as well as eight domestic television stations. This segment is also involved in the television production and distribution. Its Parks, Experiences and Products segment operates theme parks and resorts, such as Walt Disney World Resort in Florida; Disneyland Resort in California; Disneyland Paris; Hong Kong Disneyland Resort; and Shanghai Disney Resort; Disney Cruise Line, Disney Vacation Club, National Geographic Expeditions, and Adventures by Disney and Aulani, a Disney resort and spa in Hawaii, as well as licenses its intellectual property to a third party for the operations of the Tokyo Disney Resort in Japan. The company's Studio Entertainment segment produces and distributes motion pictures under the Walt Disney Pictures, Twentieth Century Studios, Marvel, Lucasfilm, Pixar, Searchlight Pictures, and Blue Sky Studios banners; develops, produces, and licenses live entertainment events; produces and distributes music; and provides post-production services through Industrial Light & Magic and Skywalker Sound. Its Direct-To-Consumer & International segment operates international television networks and channels comprising Disney, ESPN, Fox, National Geographic, and Star; direct-to-consumer videos streaming services consisting of Disney+/Disney+Hotstar, ESPN+, and Hulu; and operates branded apps and Websites, such as Disney Movie Club and Disney Digital Network, as well as provides streaming technology support services. The company was founded in 1923 and is based in Burbank, California.",Communication Services,175000
PG,https://logo.clearbit.com/pginvestor.com,http://www.pginvestor.com,Household & Personal Products,"The Procter & Gamble Company provides branded consumer packaged goods to consumers in North and Latin America, Europe, the Asia Pacific, Greater China, India, the Middle East, and Africa. It operates in five segments: Beauty; Grooming; Health Care; Fabric & Home Care; and Baby, Feminine & Family Care. The Beauty segment offers conditioners, shampoos, styling aids, and treatments; and antiperspirants and deodorants, personal cleansing, and skin care products under the Head & Shoulders, Herbal Essences, Pantene, Rejoice, Olay, Old Spice, Safeguard, SK-II, and Secret brands. The Grooming segment provides female and male blades and razors, pre- and post-shave products, and other shave care products; and appliances that include electric shavers and epilators under the Braun, Gillette, and Venus brands. The Health Care segment offers toothbrushes, toothpaste, and other oral care products; and gastrointestinal, rapid diagnostics, respiratory, vitamins/minerals/supplements, pain relief, and other personal health care products under the Crest, Oral-B, Metamucil, Neurobion, Pepto Bismol, and Vicks brands. The Fabric & Home Care segment provides fabric enhancers, laundry additives, and laundry detergents; and air care, dish care, P&G professional, and surface care products under the Ariel, Downy, Gain, Tide, Cascade, Dawn, Fairy, Febreze, Mr. Clean, and Swiffer brands. The Baby, Feminine & Family Care segment baby wipes, taped diapers, and pants; adult incontinence and feminine care products; and paper towels, tissues, and toilet papers under the Luvs, Pampers Always, Always Discreet, Tampax Bounty, Charmin, and Puffs brands. The company sells its products through mass merchandisers, e-commerce, grocery stores, membership club stores, drug stores, department stores, distributors, wholesalers, baby stores, specialty beauty stores, high-frequency stores, pharmacies, electronics stores, and professional channels. The Procter & Gamble Company was founded in 1837 and is headquartered in Cincinnati, Ohio.",Consumer Defensive,99000
MA,https://logo.clearbit.com/mastercard.com,http://www.mastercard.com,Credit Services,"Mastercard Incorporated, a technology company, provides transaction processing and other payment-related products and services in the United States and internationally. It facilitates the processing of payment transactions, including authorization, clearing, and settlement, as well as delivers related products and services. The company offers integrated products and services for account holders, merchants, financial institutions, businesses, governments, and other organizations, such as programs that enable issuers to provide consumers with credits to defer payments; payment products and solutions that allow its customers to access funds in deposit and other accounts; prepaid payment programs and management services; and commercial credit and debit payment products and solutions. It also provides value-added products and services comprising cyber and intelligence products, information and analytics services, consulting services, loyalty and reward programs, processing and open banking services, and issuer and acquirer processing services. The company offers payment solutions and services under the MasterCard, Maestro, and Cirrus brands. Mastercard Incorporated was founded in 1966 and is headquartered in Purchase, New York.",Financial Services,21000
PYPL,https://logo.clearbit.com/paypal.com,http://www.paypal.com,Credit Services,"PayPal Holdings, Inc. operates as a technology platform and digital payments company that enables digital and mobile payments on behalf of consumers and merchants worldwide. Its payment solutions include PayPal, PayPal Credit, Braintree, Venmo, Xoom, Hyperwallet, and iZettle products. The company's payments platform allows consumers to send and receive payments, withdraw funds to their bank accounts, and hold balances in their PayPal accounts in various currencies. It also offers gateway services that enable merchants to accept payments online with credit or debit cards, as well as digital wallets. PayPal Holdings, Inc. was founded in 1998 and is headquartered in San Jose, California.",Financial Services,26500
XOM,https://logo.clearbit.com/corporate.exxonmobil.com,http://corporate.exxonmobil.com,Oil & Gas Integrated,"Exxon Mobil Corporation explores for and produces crude oil and natural gas in the United States and internationally. It operates through Upstream, Downstream, and Chemical segments. The company is also involved in the manufacture, trade, transport, and sale of crude oil, natural gas, petroleum products, petrochemicals, and other specialty products; and manufactures and sells petrochemicals, including olefins, polyolefins, aromatics, and various other petrochemicals. As of December 31, 2020, it had approximately 22,239 net operated wells with proved reserves. The company was founded in 1870 and is based in Irving, Texas.",Energy,72000
